numb,year,description_short,description_long,count
,850,Расселение восточнославянских племен в середине IX в.,"В ходе расселения славян по Восточноевропейской равнине в VI – VIII вв., являвшего собой завершающий этап т.н. Великого переселения народов – грандиозного миграционного движения, охватившего в I тыс. н.э. Европейский континент, сложилась восточная ветвь славянства. В Восточной Европе сформировалось более десятка крупных славянских догосударственных общностей, в каждой из которых были собственные князья. ",1
,850,Расселение восточнославянских племен в середине IX в.,"В ходе расселения славян по Восточноевропейской равнине в VI – VIII вв., являвшего собой завершающий этап т.н. Великого переселения народов – грандиозного миграционного движения, охватившего в I тыс. н.э. Европейский континент, сложилась восточная ветвь славянства. В Восточной Европе сформировалось более десятка крупных славянских догосударственных общностей, в каждой из которых были собственные князья. ",1
,862,Приход Рюрика «из-за моря» на княжение к словенам в Новгород.,"В течение IX – X столетий все восточные славяне, а также ряд финноязычных народов, обитавших на Восточноевропейской равнине, были объединены под единой княжеской властью, под главенством одной династии, варяжской (скандинавской) по происхождению (т.н. династия Рюриковичей).",1
,864,Освобождение полян от хазарской дани,,1
,882,"Князь Олег захватывает Киев, убив княживших там варягов Аскольда и Дира, и делает Киев столицей Руси","Согласно «Повести временных лет», Олег в 882 г., спустившись по Днепру, хитростью захватывает Киев – центр полян, убив княживших там в тот момент варяжских предводителей Аскольда и Дира. После этого он делает Киев своей столицей. Летописец приписывает Олегу фразу в отношении Киева: «Се буди мати градом русьским». ",1
,883,Подчинение князем Олегом древлян,"После вокняжения в Киеве Олег начинает подчинение восточнославянских территориально-политических группировок (в Византии их называли славиниями). Он заставил платить дань древлян, живших к западу от Киева, северян (обитавших на Десне), и радимичей (живших на р. Сож). При этом северяне и радимичи были освобождены Олегом от дани в пользу Хазарского каганата (сильнейшего на тот момент государства Юго-Востока Восточной Европы - с центром на Нижней Волге).",1
,884,Освобождение северян от хазарской дани,"В 1595 г., с основания Обдорского острога на месте главного города Обдорского княжества, территория включена в Березовский уезд.",1
,885,Освобождение радимичей от хазарской дани,,1
,915,Уличи вытеснены печенегами со своего места,"<a href=""https://runivers.ru/bookreader/book595708/#page/58/mode/1up"" target=""_blank"">Договорная грамота 8 октября 1508</a><br />
Акты, относящиеся к истории Западной России. СПб., 1848. Т. II. 1506—1544. С. 53—56.",2
,945,Примерная дата возникновения Полоцкого княжества,"Полоцкая земля возникла в X в. на базе объединения полочан с центром в Полоцке. В конце X века Полоцкая волость была передана киевским князем Владимиром Святославичем своему сыну Изяславу и закрепилась за его потомками - Изяславичами, став в XII в. фактически независимой от Киева. ",2
,945,"Включение в Киевское государство дреговичей, волынян и уличей","В течение IX – X столетий все восточные славяне, а также ряд финноязычных народов, обитавших на Восточноевропейской равнине, были объединены под единой княжеской властью, под главенством одной династии, варяжской (скандинавской) по происхождению (т.н. династия Рюриковичей).",1
,964,Вовлечение вятичей в орбиту Русского государства после похода Святослава Игоревича на хазар,Святослав освободил вятичей от от власти хазар и подчинил их Киеву,2
,965,Хазарский поход кн. Святослава Игоревича,"В 965 г. Святослав, спустившись по Волге, разгромил центры Хазарского каганата на Нижней Волге, северном Кавказе и Нижнем Дону (по другой версии, это было сделано в результате двух походов – 965 и 969 гг.). После этого Хазария пришла в упадок и вскоре прекратила существование как государство.
",2
,978,Небольшое расширение Полоцкой земли к западу условно привязано к захвату Полоцка князем Владимиром,"Около 978 года князь Владимир Святославич совершил поход на Полоцк, убил князя Рогволода, насильно взял себе в жены его дочь Рогнеду, а после занятия Киева вклю­чил Полоцкое княжество в состав Древнерусского государства.",1
,980,Создание торговой фактории Олешье,"Олешье важное стратегическое значение, так как располагалось на пересечении сухопутных и морских путей при впадении Днепра в Чёрное море, связывавших Русь через Византию со Средиземным морем и Западной Европой и вокруг Крыма через Азовское море, Дон и Волгу с Каспийским морем и арабским миром. ",2
,980,Присоединение дреговичей,"В течение IX – X столетий все восточные славяне, а также ряд финноязычных народов, обитавших на Восточноевропейской равнине, были объединены под единой княжеской властью, под главенством одной династии, варяжской (скандинавской) по происхождению (т.н. династия Рюриковичей).",2
,980,Условная дата экспансии власти Рюриковичей на левый берег р. Западный Буг,"В 1563 г. власть в сибирском ханстве захватил чингисид Кучум, который сразу прекратил прежние вассальные отношения с Россией. Окончательно захватив Сибирское ханство, Кучум согласился в 1571 г. на вассальную зависимость и выплату ясака Москве. Однако уже в 1573 г. он разорвал даннические отношения с Москвой. Его племянник Маметкул и сын Алей, пользуясь трудностями Москвы, связанными с Ливонской войной, подошли к Перми и вторглись во владения Строгановых. Это вызвало попытку ногайских татар отделиться от Москвы и черемисский бунт. В ответ организуется в сентябре 1581 г. поход Ермака в Сибирь. 1 октября 1581 г. Кучум выдержал натиск Ермака под Чувашской горой, но 26 октября был разбит Ермаком на правом берегу Иртыша у Чувашского мыса. Ермак беспрепятственно вступил в Искер, столицу Сибири. Сибирское ханство было разгромлено.",1
,981,присоединение волынян и белых хорватов,"В 1554 г. астраханский хан Дервиш-Али признал себя вассалом московского царя. Одновременно астраханский хан вел переговоры о союзе с Крымом, надеясь с его помощью противостоять Москве. Узнав об этом, московские власти отправили на юг войска. В 1556 г. при приближении к Астрахани русских полков Дервиш-Али бежал. Астрахань сдалась без боя. Все владения Астраханского ханства, включая часть Башкирии и Прикаспийские районы до нижнего течения реки Яик (ныне река Урал), вошли в состав России.",1
,983,Покорение балто-литовского племени ятвягов. Присоединение их земель открыло путь к Балтийскому морю,"Предводители башкирских племен были пожалованы в тарханы и князья, а некоторые произведены в старосты. Приведены примерные границы обитания башкир в XVII веке.

Перевод «копии с копии» жалованной грамоты Ивана IV башкирам 4-х южных родов:
«Великий наш шах и царь Иван Васильевич Грозный начиная с 1547 г. приходил вместе с русским войском [досл. обществом] брать город Казань; после многих сражений при татарском хане Ядкаре 2 октября 1552 г. [Иван Грозный] окончательно взял [город] в свои руки. И так же, как [сделали] в городе Казани, сделали в юртах. После этого башкиры четырех племен, [которые живут] к востоку от Казани, послали к этому царю Ивану одинаково знатных людей. Он сам желал их прибытия, из них: 1-й от родов Усерган князь Бикбау; 2-й от рода Бурзян князь Искэ-бий; 3-й от рода Кыпчак князь Мешвали Каракузяк; 4-й из Тамьяна князь Шагали Шакман.
Эти четыре бия, прибыв в город Казань, стали известными Ивану Грозному. Башкир [досл. башкирское общество] приняли [в русское подданство] с [условием] верной службы [царю]; после принятия в подданство [царь], оказав милость, наградил их самих [т. е. послов] тарханским званием; [затем] обратились с нижайшей просьбой отмерить [башкирам] ихние земли, воды и выдать им [на владение этими землями] грамоту. По их [т. е. башкирских послов] просьбе, он, великий царь Иван Грозный, своим указом [повелел] эти земли отмерить, то есть определить их границы. Для этого в Ногайскую и Сибирскую дороги направил повелительные письма; опираясь на эти письма, народ ете ырыу, то есть “семи родов”, посоветовавшись [между собой] и согласившись [друг с другом], решили земли, которыми владели их рода, как то степи и леса, разделить. И в 1564 г. согласились [платить] ясак — положенный Грозным ясак [состоял] из лошадей, и куниц, и лисиц, и разного другого ясака, — который, посоветовавшись, разделили [между собой].
О [границах] некоторых отмеренных земель ниже рассказывается. Сначала [земли] по течению реки Яик, нижняя граница от Сарымсака, верхняя граница до Бузсавыла, по рекам Кизил, Сакмара и Зилаир от истоков до устья и с горами, и по рекам Ачили, Учкалик, и двум Сурэмам от истоков до устья и с горами, и [далее] с верховья Саелмыша, с верховья рек Аяк, Мену, от брода [реки] Кираузэ, от реки Мену до Одинокой ивы, и через Ногайский брод от Иртубека до вершины Уксэр, и от истока Сулака, от леса [досл. лиственницы] Уткэш, горы Миазак, верховий Калмака и Башазилар с горами и водами, и от поля Айин луг, от истоков Элэмсэта, от горы Алти Тура [на берегу] Сакмары до вершины Лаембирде и от брода реки Таналык вместе с камышами, от Тюбы, небольшой горы, вниз по реке Четум — [все эти] земли стали владениями башкир родов Тунгэк и Усерган.
Затем [земли]: нижняя граница — от упомянутого Сарымсака, три [реки] Узени, до горы в степной стороне, три реки Чезми и Кэмэлек от истоков до устьев со всеми горами, верхняя граница — до глубокого озера, например [озеро] Дурткуль, все эти земли стали “особенным” владением рода Бурзян.
У Усерган с Бикбау-князем, у Тамьян с Шагали Шакман-князем, у Бурзян с Искэби-князем, у Кыпчак с Мешавле Каракузяк князем, у всех родов были [родовые] земельные владения. Те земли, которые, посоветовавшись и отмерив, отделили, в упомянутом городе Казани закрепили в книге.
Если при уплате известного лисьего ясака, лис не могли добыть, то рассчитывались медью, от десяти копеек, пятидесяти копеек и до 55 копеек. Подтверждая это, великий царь вместе со знатными приближенными руки приложили».

<a href=""http://vatandash.ru/?article=1505"" target=""_blank"">Жалованные грамоты Ивана Грозного башкирам</a><br />",2
,985,Вовлечение в орбиту Русского государства муромы после похода Владимира Святославича на булгар,,2
,988,Корсунский поход князя Владимира Святославича,"Придя к власти, Владимир поначалу попытался реформировать язычество, создав общерусский пантеон богов во главе с Перуном. Но затем он пришел к решению о принятии христианства. В 988 г. Владимир договорился с византийским императором Василием II и его братом и соправителем Константином VIII о помощи им против мятежника Варды Фоки в обмен на выдачу за русского князя замуж сестры императоров Анны. Условием брака было крещение Владимира. Императоры не торопились выполнить договоренность, и тогда Владимир взял Корсунь (Херсонес) – центр крымских владений Византии. После этого Анна была прислана к нему, и князь принял крещение. По возвращении на Русь было осуществлено крещение киевлян и затем началось утверждение новой веры по всей Руси. Была создана русская церковная организация во главе с митрополитом, подчинявшаяся константинопольской патриархии. ",1
,1015,Постепенное расширение зоны влияния киевских князей Условно соотнесено с годом смерти великого князя Владимира Святославича,,1
,1018,Захват Червенских городов Польшей,"В 981 году Владимир Святославич в результате своего похода на Польшу присоединил их к Руси. В 1018 году Святополк возвратил их Болеславу I в благодарность за его поход на Киев и помощь в захвате власти киевского престола, однако в 1031 году они были возвращены в результате похода Ярослава Мудрого на Польшу.",1
,1030,Основание города Юрьева,"Относился к опорным городам-крепостям Поросской оборонительной линии, заложенным Ярославом Мудрым в 1032 году. Их задачей была защита южного порубежья государства от набегов степных кочевников. Согласно летописям, Ярослав Мудрый поселил в Поросье много пленных ляхов, приведённых из польского похода. ",2
,1031,Возврат червенских городов от Польши,"В 981 году Владимир Святославич в результате своего похода на Польшу присоединил их к Руси. В 1018 году Святополк возвратил их Болеславу I в благодарность за его поход на Киев и помощь в захвате власти киевского престола, однако в 1031 году они были возвращены в результате похода Ярослава Мудрого на Польшу.",2
,1032,Строительство Ярославом Мудрым системы укреплений на р. Рось,"Поросская оборонная линия — цепочка сторожевых крепостей по реке Рось, основанных в эпоху Древнерусского государства для защиты от набегов степных кочевников. К таким крепостям относились Белая Церковь (Юрьев), Торческ, Володарев, Дверен, Корсунь, Богуславль, Ростовец, Бакожин, Родень и другие.
Основной период строительства оборонных городов пришёлся на 1030-е годы, когда Ярослав Мудрый начал селить в приграничном Поросье пленных поляков. Часть населения поросских городов составляли чёрные клобуки, состоявшие в ленной зависимости от киевских князей и участвовавшие в обороне русских земель.
Кроме военно-феодальных крепостей, южные рубежи укреплялись валами — грандиозными земляными насыпями и рвами, которые простирались вдоль левого берега Роси и Раставицы. Остатки вала, который составляет приблизительно 75 км, сохранились возле Ягнятина и Фурсово. В древнерусские времена эти валы имели вид деревянно-земляных стен высотой до 3,5 м и шириной 6-7 м. Перед ними выкапывались рвы шириной 5-6 м и глубиной 1,5-2 м.",2
,1042,Первый конный поход новгородцев под предводительством князя Владимира Ярославовича на емь привел к рсширению зоны даней Новгорода,,2
