numb,year,description_short,description_long,count
1,1604,Постройка Томска.,"4 апреля 1604 г. царем Борисом Годуновым дан наказ сургутскому голове Г. И. Писемскому и боярскому сыну В. Ф. Тыркову с повелением строить Томский город, завести вокруг него государеву пашню и привести в подданство российскому царю окрестные народы. Царь Борис благословил первостроителей Томского города иконою Святой Живоначальной Троицы.
7 октября 1604 г. кетский воевода Постник Бельский послал в приказ Казанского и Мещерского дворца отписку, в которой указал, что к этому дню Томский «город сделали со всеми крепостцами».",1
1,1607,В устье Нижней Тунгуски было срублено Туруханское зимовье. В 1672 г. здесь был заложен русский город Новая Мангазея. С 1780-х гг. Новая Мангазея называется Туруханском и числится в Томской губернии. Позднее поселение называется уже Старотуруханском.,"<a href=""http://www.rusarchives.ru/projects/statehood/09-02-deklaraciya-obrazovanie-sssr-1922.shtml"" target=""_blank"">Декларация и Договор об образовании СССР</a><br />",1
1,1617,"По Столбовскому мирному договору Швеция вернула России Новгород, Порхов, Старую Руссу, Ладогу, Гдов и Сумерскую волость. Россия уступала Швеции Ивангород, Ям, Копорье, Орешек, Корелу. Россия оказалась отрезанной от Балтийского моря.","Столбовский мирный договор – договор между Россией и Швецией, положивший конец русско-шведской войне 1613–1617 гг., был подписан 27 февраля 1617 г. в селе Столбово.

По условиям договора Швеция возвращала России захваченные у нее во время Смуты земли: Новгород, Старую Руссу, Порхов, Ладогу, Гдов с уездами и Сумерскую волость. Россия, в свою очередь, передавала Швеции Ижорской землю с Иван-городом, Ямом, Копорьем, а также все Поневье и Орешек с уездом. За шведами оставался г. Корела с уездом. Сверх этого Россия должна была выплатить Швеции контрибуцию в размере 20 000 руб. серебром. Кроме того, Россия отказывалась от притязаний на Лифляндию, а русский царь должен был исключить из своего титула это название. Особой статьей оговаривались взаимный отказ от помощи Польши и необходимость заключения союза против нее.

Несмотря на значительные территориальные потери и денежную контрибуцию, Столбовский мирный договор в значительной степени снимал напряжение на северо-западных рубежах России и способствовал медленному восстановлению страны после Смуты. 

<a href=""http://www.runivers.ru/mp/maps-detail.php?ID=469520&SECTION_ID=8212"" target=""_blank"">Карта Финляндии с указанием границ России и Швеции в разное время по договорам, а также по картам генерального штаба, Гермелина, Лоттера, Аф-Кнорринга и друг.</a><br />",1
1,1618,Основание Кузнецкого острога.,"<a href=""http://ostrog.ucoz.ru/publikacii_2/4_74.htm"" target=""_blank"">Кузнецкий острог 1618 г. и его перестройка в 1620 г.</a><br />",2
2,1618,"Согласно условиям Деулинского перемирия, Россия уступала Польше Смоленск, Белый, Рославль, Монастыревск, Чернигов, Стародуб, Попову Гору, Новогород-Северский, Почеп, Трубчевск, Серпейск, Невель, Себеж, Красный и Вележ с уездами и волостями. В обмен на столь значительные территориальные уступки Польша возвращала России икону Св. Николая Можайского. Также она возвращала России захваченные ею города: Вязьму, Козельск, Мещевск, Мосальск. ","Деулинское перемирие 1618 г.
Перемирие, заключенное между Россией и Польшей в деревне Деулино 1 декабря 1618 г. сроком на 14 лет и 6 месяцев, начиная с 25 декабря 1618 г. 
Согласно условиям перемирия, Россия уступала Польше Смоленск, Белый, Рославль, Монастыревск, Чернигов, Стародуб, Попову Гору, Новогород-Северский, Почеп, Трубчевск, Серпейск, Невель, Себеж, Красный и Вележ с уездами и волостями. В обмен на столь значительные территориальные уступки Польша возвращала России захваченные ею города: Вязьму, Козельск, Мещевск, Мосальск. Договаривающиеся стороны брали на себя обязательства не помогать ни людьми, ни деньгами недругам другой стороны. Польские купцы при уплате пошлин получали право свободной торговли во всех русских городах, кроме Москвы. Русские купцы получали те же права на территории Польши. Договор предусматривал обмен пленными. Особо оговаривалось возвращение русских послов во главе с патриархом Филаретом и князем В. Голицыным. Королевич Владислав на период перемирия не должен был ни тайно, ни явно добиваться Московского престола. Все польские войска и запорожские казаки должны были немедленно по заключению перемирия очистить территорию Московского государства. 
Деулинское перемирие 1618 г. положило конец польской интервенции. В этом смысле его значение аналогично значению Столбовского мирного договора. Выйдя из многолетней войны с большими территориальными потерями, Россия получала необходимый мир для восстановления разрушенного государства.",2
1,1619,Основание Енисейского острога отрядом тобольских казаков во главе с боярским сыном Петром Албычевым и стрелецким сотником Черкасом Рукиным.,"Согласно декрету, территорией СССР объявлялись «расположенные в Северном Ледовитом океане, к северу от побережья Союза ССР до северного полюса в пределах между меридианом тридцать два градуса четыре минуты тридцать пять секунд восточной долготы от Гринвича, проходящим по восточной стороне Вайда-губы через триангуляционный знак на мысу Кекурском, и меридианом сто шестьдесят восемь градусов сорок девять минут тридцать секунд западной долготы от Гринвича, проходящим по середине пролива, разделяющего острова Ратманова и Крузенштерна группы островов Диомида в Беринговом проливе».
Постановление делало исключение для земель и островов, принадлежность которых иностранным государствам была ранее признана советским правительством (имелись в виду архипелаг Шпицберген и о. Медвежий, владение которыми Норвегией закреплено Парижским договором от 9 февраля 1920 г.).
В 1979 г. СССР уточнил восточные границы своих полярных владений с «168 градусов 49 мин. 30 сек.» на «168 градусов 58 мин. 49,4 сек.».",1
1,1628,Постройка Красноярского острога отрядом казаков под руководством Андрея Ануфриевича Дубенского.,,1
1,1630,Основание Илимского зимовья енисейскими служивыми людьми под руководством атамана Ивана Галкина.,,1
1,1631,Основание Братского острога для сбора ясака и в поисках залежей серебряных руд.,,2
2,1631,"Основание Чечуйского острога. По данным Герарда Фридриха Миллера, основал острог промышленник Пенда (или Пянда).",,2
1,1632,"В 1632 г. отряд енисейского казака сотника Петра Бекетова основал Ленский острог, и в этом же году летом группа казаков из этого отряда под руководством Алексея Архипова и Луки Яковлева спустилась вниз по реке Лене и в 770 км от Ленского острога на левом берегу Лены построила Жиганское зимовье.","<a href=""http://ostrog.ucoz.ru/publ/s/safronov_f_g/osnovanie_goroda_jakutska/147-1-0-232"" target=""_blank"">Основание города Якутска</a><br />",1
1,1634,"Основание Вилюйского острога енисейскими казаками во главе с Посником Ивановыми и землепроходцами Ребровым и Перфирьевым, а также Янского зимовья для ясачного сбора.","<a href=""http://www.rusarchives.ru/projects/statehood/09-44-deklaraciya-ukraine.shtml"" target=""_blank"">Декларация «О вхождении Западной Украины в состав Украинской Советской Социалистической Республики»</a><br />

<a href=""http://www.rusarchives.ru/projects/statehood/09-15-deklaraciya-zapadnaya-belarus.shtml"" target=""_blank"">Декларация «О вхождении Западной Белоруссии в состав Белорусской Советской Социалистической республики»</a><br />",2
2,1634,"Поляновский мирный договор заключен между Россией и Речью Посполитой, положил конец Смоленской войне 1632–1634 гг. Россия уступала Речи Посполитой свои территории, которые были захвачены поляками в ходе Смуты (за исключением Серпейска). Польская сторона должна была вывести свои войска с территории России. Польский король Владислав IV официально отказался от притязаний на русский престол.","<a href=""https://www.runivers.ru/doc/d2.php?CENTER_ELEMENT_ID=147435"" target=""_blank"">Телеграмма наркома иностранных дел CCCР В. М. Молотова полномочному представителю CCCР в королевстве Румыния А. И. Лаврентьеву</a><br />",2
1,1636,Постройка Канского острога казаками под руководством атамана Ермака Остафьева для сбора ясака.,,1
1,1638,Основание Верхоянского зимовья как казачьего зимовья Посником Ивановым.,,1
1,1639,Основание Зашиверского зимовья отрядом енисейского казака Посника Иванова для сбора ясака. Зашивенск стал центром территории от реки Яны на западе до Колымы на востоке.,"<a href=""http://www.rusarchives.ru/projects/statehood/09-18-deklaraciya-latviya.shtml"" target=""_blank"">«Декларация о вхождении Латвии в состав СССР»</a><br />

4 мая 1990 года Верховным Советом Латвийской ССР была принята «Декларация о восстановлении государственной независимости Латвийской Республики». 6 сентября 1991 года независимость Латвии была признана Государственным Советом СССР.",1
1,1640,Основание Майского зимовья.,"<a href=""https://ru.wikisource.org/wiki/%D0%A1%D1%82%D1%80%D0%B0%D0%BD%D0%B8%D1%86%D0%B0:Sbornik_zakonov_1938-1956.djvu/57"" target=""_blank"">Закон от 6 августа 1940 г. «О принятии Эстонской Советской Социалистической Республики в Союз Советских Социалистических Республик»</a><br />",1
1,1641,Основание Ачинского острога тарским воеводой Я. О. Тухачевским,"<a href=""http://ostrog.ucoz.ru/publ/s/skobelev_s_g_churikov_r_s/k_voprosu_o_meste_raspolozhenija_pervogo_achinskogo_ostroga/194-1-0-345"" target=""_blank"">К вопросу о месте расположения первого Ачинского острога</a><br />",2
2,1641,Основание Верхоленского острога пятидесятником Мартыном Васильевым. ,"<a href=""http://ostrog.ucoz.ru/publikacii/4_47_36.htm"" target=""_blank"">Челобитная тобольских, березовских и енисейских служилых людей в Сибирский приказ об основании Верхоленского острога, сборе ясака с тунгусов и бурят, столкновениях с ними и лишениях, которым подвергались служилые люди</a><br />",2
1,1643,Ленский острог перенесен на место Якутска.,,3
2,1643,Основание Верхнеангарского острога отрядом енисейских казаков во главе с десятником С. Скороходовым для сбора ясака с северо-байкальских тунгусов,,3
3,1643,Основание Среднеколымского острога и Нижнеколымского зимовья русским землепроходцем Михаилом Стадухиным и казаком Дмитрием Зыряном.,"<a href=""http://ostrog.ucoz.ru/publ/s/sergeev_o_i_chernavskaja_v_n_kazak_m_v/stadukhin_issledovatel_severo_vostoka_azii/160-1-0-270"" target=""_blank"">Казак М. В. Стадухин — исследователь северо-востока Азии</a><br />",3
1,1647,Основание зимовья на месте Охотска казаками под предводительством атамана Семена Шелковникова и Верхнеколымского зимовья.,"В Каирской Декларации от 27 ноября 1943 г. указывалось, что цель союзных держав состоит в том, чтобы лишить Японию территорий, захваченных ею в результате военной интервенции: Корея, Тайвань, группа островов в Тихом Океане и южный Сахалин с островами Курильской гряды, которые Япония захватила в результате русско-японской войны в 1905 г.
Впоследствии, 11 февраля 1945 г., на ялтинской конференции союзники достигли договоренности о вступлении СССР в войну против Японии при обязательном условии — возвращение в состав СССР Южного Сахалина и Курильских островов.
2 сентября 1945 г. был подписан Акт о капитуляции Японии.
Отсоединение Курильских островов от Японии и присоединение их к территории СССР произошло 29 января 1946 г. Меморандумом №677 Главнокомандующего Союзных Держав.
2 февраля 1946 г. на этих территориях была образована Южно-Сахалинская область в составе Хабаровского края РСФСР.",1
1,1648,Основание Баргузинского острога енисейскими казаками атамана Ивана Галкина.,"<a href=""http://ostrog.ucoz.ru/publ/e/16-1-0-28"" target=""_blank"">Основание и развитие Баргузинского и Селенгинского острогов в ХVII—ХVIII вв.</a><br />",2
2,1648,Основание Удинского острожка.,"В статье VI Потсдамского соглашения «О городе Кенигсберге и прилегающем к нему районе» говорится о том, что прилегающая к Балтийскому морю часть западной границы СССР проходит от пункта на восточном берегу Данцигской бухты, обозначенного на прилагаемой карте к востоку — севернее Браунсберга—Гольдапа, к стыку границ Литвы, Польской Республики и бывшей Восточной Пруссии.",2
1,1649,Дата основания Анадырского острога условна. С этого времени начинается процесс включения Чукотки в состав России.,"Анадырский острог был поставлен С. И. Дежневым летом 1649 г. Первоначально казаки поставили зимовье, не имевшее укреплений. О его точном местоположении есть разные предположения. По мнению И. С. Вдовина (Вдовин И. С. Анадырский острог // Краевед. записки. Магадан, 1959. Вып. 2. С. 20–27), специально исследовавшего эту проблему, поселение было основано примерно в 18 км выше современного села Марково, в районе сел Солдатово и Оселкино, на одном из островов р. Анадырь. Некоторые исследователи считали, что его заложили на левом берегу Анадыря при впадении в него протоки Прорвы, выходящей из правого притока Анадыря р. Майн, причем не выше, а ниже, в 10–15 км от с. Марково.

<a href=""http://geoman.ru/books/item/f00/s00/z0000088/pic/map010.jpg"" target=""_blank"">«Чертеж вновь Камчадальские земли и моря». Служебная книга С. У. Ремезова (Гос. публичная библиотека им. М Е. Салтыкова Щедрина, Эрмитажное собрание, № 237, стр. 102)</a><br />",1
1,1652,Основание Тугурского острога командой казаков под начальством И. А. Нагибы.,"<a href=""http://istorik.ucoz.com/publ/dopolnitelnyj_material/istochniki/deklaracija_o_porazhenii_germanii_1945_god/20-1-0-1305"" target=""_blank"">Декларация о поражении Германии и взятии на себя верховной власти в отношении Германии правительствами Союза Советских Социалистических Республик, Соединенного Королевства и Соединенных Штатов Америки и Временным правительством Французской республики</a><br />",1
1,1653,Основание Тауйска русским землепроходцем Михаилом Стадухиным.,"14 февраля 1950 г. было заключено соглашение с Китаем о выводе советских войск из Порт-Артура и передаче сооружений в этом районе Китаю после подписания договора с Японией, но не позже конца 1952 г. 15 сентября 1952 г. после обмена нотами между Китаем и СССР срок вывода советских войск был продлен до заключения мирных договоров между Китаем и Японией и СССР и Японией. Вывод советских войск и передача территории под китайскую юрисдикцию завершены в мае 1955 г.",2
2,1653,"Постройка Читинского, Иргенского и Нелюцкого острогов.","<a href=""http://ostrog.ucoz.ru/ostrogy/2_2.htm"" target=""_blank"">Иргенский острог</a><br />

<a href=""http://ostrog.ucoz.ru/ostrogy/2_16.htm"" target=""_blank"">Основание города Якутска</a><br />",2
1,1654,"В 1653 г. енисейский воевода Афанасий Пашков поручает боярскому сыну Дмитрию Фирсову перенести Братский острог на левый берег Оки и, следуя вверх по Ангаре, поставить острог между «немирными балаганскими людьми». Там в 1654 году был построен Балаганский острог.","<a href=""http://ostrog.ucoz.ru/ist_doc_2/1_51.htm"" target=""_blank"">Отписка енисейского воеводы Афанасия Пашкова в Сибирский приказ о постройке Балаганского острога и о поселении пашенных крестьян и служилых людей</a><br />",2
