numb,year,description_short,description_long,count
,1329,Подписание Болотовского договора (дата по В.Л. Янину) ,"Георгиевский трактат представляет собой договор между Россией и грузинским царством Картли-Кахети (Восточная Грузия) о признании грузинским царем Ираклием II покровительства России. С грузинской стороны договор подписали князя И. Багратион и Г. Чавчавадзе, с русской – П. С. Потемкин. Россия гарантировала целостность владений грузинского царя взамен на отказ последнего от самостоятельной внешней политики. Грузинский престол оставался наследственным, но каждый раз при восшествии на него нового правителя требовалось разрешения русского царя. Грузии предоставлялась внутренняя автономия. Грузинские привилегированные сословия уравнивались в правах с русскими. Россия не только обязывалась защищать Грузию в случае нападения на нее, но должна была дипломатическими путями настаивать на возвращение ей отторгнутых Турцией территорий.

Георгиевский трактат значительно укрепил позиции России в Закавказье и защитил Восточную Грузию от посягательств на ее территории со стороны Турции и Персии. Вместе с тем он открыл перспективу полного присоединения Грузии к России.

<a href=""http://www.runivers.ru/doc/d2.php?CENTER_ELEMENT_ID=147497"" target=""_blank"">Текст Георгиевского трактата</a><br />",2
,1340,Присоединение к  Великому княжеству Литовскому  Галицкой земли,,2
,1341,Создание Нижегородско-Суздальского княжества,"Суздальское княжество в 1341 г. объединено с Нижегородским княжеством в Нижегородско-Суздальское княжество.
",2
,1348,"Включение в Великое княжество Литовское Орши, Лукомля, Минска, Друцка и других городов",,2
,1356,Захват Великим княжеством Литовским Торопца,"Договор подписан в г. Яссы по итогам русско-турецкой войны 1787–1791 гг. Со стороны России договор подписали А. Н. Самойлов, О. М. де Рибас, С. Л. Лашкарёв. Со стороны Турции – Абдулла эфенди, Ибрагим Исмет бей, Мехмед эфенди. По условиям договора восстановилось действие Кючук-Кайнарджийского мирного договора 1774 г. и Турция признавала Георгиевский трактат 1783 г. Россия получала территории между Южным Бугом и Днестром. Днестр объявлялся границей между державами. Молдавия и Валахия возвращались Турции. Однако на жителей этих областей распространялись льготы, предусмотренные Кючук-Кайнарджийским миром. На Кавказе восстанавливалась граница по реке Кубань. Турция обязывалась не нападать на Грузию и кубанские земли.
Благодаря Ясскому миру Россия получила возможность освоения южных территорий и развития черноморской торговли.

<a href=""http://www.runivers.ru/bookreader/book456128/#page/69/mode/1up"" target=""_blank"">Текст Ясского мирного договора с Турцией</a><br />

a href=""https://ru.wikipedia.org/wiki/%D0%AF%D1%81%D1%81%D0%BA%D0%B8%D0%B9_%D0%BC%D0%B8%D1%80%D0%BD%D1%8B%D0%B9_%D0%B4%D0%BE%D0%B3%D0%BE%D0%B2%D0%BE%D1%80#/media/File:%D0%9C%D0%B0%D0%BD%D0%B8%D1%84%D0%B5%D1%81%D1%82_%D0%BE_%D0%AF%D1%81%D1%81%D0%BA%D0%BE%D0%BC_%D0%BC%D0%B8%D1%80%D0%BD%D0%BE%D0%BC_%D0%B4%D0%BE%D0%B3%D0%BE%D0%B2%D0%BE%D1%80%D0%B5_%D1%81_%D0%9E%D1%81%D0%BC%D0%B0%D0%BD%D1%81%D0%BA%D0%BE%D0%B9_%D0%98%D0%BC%D0%BF%D0%B5%D1%80%D0%B8%D0%B5%D0%B9,_25_%D1%84%D0%B5%D0%B2%D1%80%D0%B0%D0%BB%D1%8F_1792_%D0%B3%D0%BE%D0%B4%D0%B0.JPG"" target=""_blank"">Манифест о Ясском мирном договоре с Османской Империей, 25 февраля 1792 г.</a><br />

<a href=""http://www.runivers.ru/mp/maps-detail.php?ID=466762&SECTION_ID="" target=""_blank"">Карта ""Русско-турецкая война 1787–1791 гг. Территориальное изменение по Ясскому мирному договору 29 декабря 1791 г.""
</a><br />

Присоединение Крыма к России стало логическим завершением продвижения России к Черноморскому побережью. В 1774 г. по условиям Кючук-Кайнарджийского мирного договора Крым получил автономию. Однако сохранить независимость крымскому ханству было сложно. С одной стороны, Турция не желала мириться с потерей полуострова. Султан явно надеялся на его возвращение под свой протекторат. С другой стороны, внешнеполитические интересы России также не предусматривали независимого государства на северном побережье Черного моря. Внутри самого ханства боролись две силы: протурецкая и прорусская. Зимой 1780 г. сторонники султана в Крыму подняли восстание против ориентированного на Россию хана Шахин-Гирея. Он был вынужден бежать, а его место занял сторонник султана Бахадыр-Гирей. Летом 1782 г. русские войска под командованием Г. А. Потемкина вступили в Крым под предлогом возвращения на престол Шахин-Гирея. В этом Россию поддержала Австрия. Однако в планы императрицы Екатерины II входило не восстановление на престоле изгнанного хана, а полное присоединение Крыма. Нужен был формальный повод со стороны Турции для оправдания захвата. Однако султан повода не давал. В результате было объявлено о нападении турок на Тамань. Этот сфабрикованный предлог позволил Екатерине II объявить о присоединении Крыма к России. Юридическим основанием стал Манифест «О принятии полуострова крымских жителей и прочих татарских народов в Российское подданство, острова Тамана и всей Кубанской стороны под Российскую державу» от 8 апреля 1783 г. В нем, в частности, говорилось, что императрица обязуется содержать крымских татар «наравне с природными Нашими подданными, охранять и защищать их лица, имущество, храмы и природную веру».

Эта акция вызвала негативную реакцию у Англии и Франции. Возникла опасность войны. Однако очень скоро внутри Англии произошли изменения. На выборах премьер-министра победил Джемс Харисс. Сформированный им кабинет согласился с действиями Екатерины II в Крыму. Франция осталась в одиночестве. В этих условиях Турция вынуждена была де-факто (не де-юре) признать вхождение Крыма в состав России.

<a href=""http://www.runivers.ru/doc/d2.php?SECTION_ID=6362&CENTER_ELEMENT_ID=147028&PORTAL_ID=6362"" target=""_blank"">Манифест о присоединении Крыма к России</a><br />

<a href=""http://www.runivers.ru/bookreader/book9829/#page/891/mode/1up"" target=""_blank"">Оригинальный текст</a><br />

<a href=""http://www.runivers.ru/doc/d2.php?CAT=Y&SECTION_ID=6358&PORTAL_ID=6358
"" target=""_blank"">Крым. История вхождения в Российскую Империю</a><br />",2
,1359,Захват части земель Смоленского княжества Великим княжеством Литовским,,1
,1362,"Присоединение к Великому княжеству Литовскому   Северской, Киевской земель и Поросья","12 (23) января 1793 г. Пруссия и Россия подписали конвенцию о втором разделе Польши, которая была утверждена на созванном тарговичанами Гродненском сейме (1793). Одним из главных представителей России при разделе Польши императрицей Екатериной II был назначен премьер-майор Генерального штаба Михаил Леонтьевич Булатов (1760–1825).

<a href=""http://www.runivers.ru/bookreader/book10086/#page/172/mode/1up"" target=""_blank"">Конвенция между Россией и Пруссией относительно нового раздела Польши</a><br />",2
,1363,Присоединение Галицкого княжества к Московскому княжеству,"В 1793 г. скончался последний герцог в роду Фридрих Август. Удельное княжество Эверланд (Йевер) по «закону прялки» унаследовала его сестра – урожденная принцесса Ангальт-Цербстская, которая в то время была уже императрицей России Екатериной II. Она, хотя в Германии этого и ждали, не отказалась от этого фризского надела и к своим титулам прибавила титул Herrin von Jever.
В 1806 г. княжество было оккупировано Французской империей.
В 1807 г. император Александр I уступил Эверланд Голландии, а в 1814 г. он был присоединен к герцогству Ольденбург, которое управлялось герцогом Ольденбургским, дядей императора Александра I.",2
,1365,"Сражение у Шишевского леса, условно соотнесено с продвижением древнерусской колонизации на юго-восток Рязанской земли","Сражение у Шишевского леса — сражение войск Рязанского и Карачевского княжеств против войск Золотой Орды, закончившееся решительной победой русских войск",1
,1365,"Сражение у Шишевского леса, условно соотнесено с продвижением древнерусской колонизации на юго-восток Рязанской земли","Сражение у Шишевского леса — сражение войск Рязанского и Карачевского княжеств против войск Золотой Орды, закончившееся решительной победой русских войск",1
,1368,Переход Ржевы к Московскому княжеству,"В 1355 г. Ржева была завоевана Великим княжеством Литовским. Зимой 1358-1359 г. войска Твери и Можайска ее отбили. Затем в 1360-70-х гг. ее несколько раз снова захватывали литовские войска. Тверские и московские войска (можайская рать) в 1358 г. опять отвоевали Ржеву, но вскоре вновь ее потеряли. В 1368 г. Ржеву захватил уже у тверичей князь Владимир Андреевич Серпуховский. В 70-е гг. XIV в. Ржевой владел Литва и Москва тщетно пыталась отвоевать ее у Литвы. Воспользовавшись смертью великого князя литовского (в 1377 году), Ржеву отобрал тверской князь Михаил Александрович, о чем и заявил в своем завещании 1399 года. Ржева была отдана старшему сыну Ивану - новому великому князю тверскому.
",2
,1373,Переход Ржевы к  Великому княжеству Литовскому,"В 1355 г. Ржева была завоевана Великим княжеством Литовским. Зимой 1358-1359 г. войска Твери и Можайска ее отбили. Затем в 1360-70-х гг. ее несколько раз снова захватывали литовские войска. Тверские и московские войска (можайская рать) в 1358 г. опять отвоевали Ржеву, но вскоре вновь ее потеряли. В 1368 г. Ржеву захватил уже у тверичей князь Владимир Андреевич Серпуховский. В 70-е гг. XIV в. Ржевой владел Литва и Москва тщетно пыталась отвоевать ее у Литвы. Воспользовавшись смертью великого князя литовского (в 1377 году), Ржеву отобрал тверской князь Михаил Александрович, о чем и заявил в своем завещании 1399 года. Ржева была отдана старшему сыну Ивану - новому великому князю тверскому.
",2
,1374,Первое упоминание Вятской земли,"21 марта 1800 г. в Константинополе Российская и Османская империи подписали конвенцию, согласно которой на территории трех бывших французских департаментов, за исключением городов Первеза, Воница, Бутринти и Парга, расположенных на континенте, была образована Республика Семи Островов под покровительством двух империй на островах Керкира, Паксос, Лефкас, Кефалиния, Итака, Закинф и Китира в Ионическом море.

<a href=""http://www.runivers.ru/bookreader/book9834/#page/87/mode/1up"" target=""_blank"">Константинопольская конвенция 1800 г.</a><br />",1
,1378,"Удачный поход нижегородских и московских сил на мордву, условная отправная точка вовлечение мордвы в зависимость от власти Рюриковичей","<a href=""https://web.archive.org/web/20010108062900/
http://www.tuad.nsk.ru/~history/Russia/Imperia/Alexandr_I/man12-9-1801.html"" target=""_blank"">Высочайший манифест 12-го сентября 1801 года</a><br />

<a href=""https://upload.wikimedia.org/wikipedia/commons/4/4a/Treaty_of_Georgievsk_of_1783_%28Esadze%2C_1913%29.JPG"" target=""_blank"">Оригинал Манифеста. Эсадзе Б. С. Летопись Грузии (Выпуск 1). тип. Канцелярии Наместника Е.И.В. на Кавказе. 1913</a><br />",1
,1381,Князь Дмитрий Иванович Донской приобрел часть мещерских земель у местных князей. Включение территории в Московское княжество,"Впервые как московское владение Мещера упоминается в договоре Дмитрия Донского с Олегом Ивановичем Рязанским лета 1381 г.: «А что купля князя великого Мещера, как было при Александре Уковичѣ, то князю великому Дмитрию, а князю великому Олгу не вступатися по тот розъездъ».
Таким образом, по мнению А.А.Горского,  ранее лета 1381 г. Дмитрий Иванович «купил», очевидно у местных князей, Мещеру или ее часть. В летописном рассказе о походе Дмитрия Донского на Новгород зимой 1386—1387 гг. в числе участвовавших в нем ратей упоминается и «мещерская»",1
,1382,Переход Ржевы к Московскому княжеству,В 1804 г. имеретинский царь Соломон II принял покровительство России. В 1811 г. Имеретинское царство было преобразовано в Имеретинскую область Российской империи.,1
,1383,Образование Великого княжества Московского,"Московское княжество  было выделено из великого княжества Владимирского по завещанию Александра Невского в удел его младшему сыну— Даниилу Александровичу. В 1383 оно слилось с великим княжеством Владимирским, поскольку московские князья закрепили за собой великое княжение. При Иване III, с присоединением Новгорода, Твери и других территорий, Великое княжество Московское переросло в Российское государство. ",2
,1383,Образование Великого княжества Московского,"Московское княжество  было выделено из великого княжества Владимирского по завещанию Александра Невского в удел его младшему сыну— Даниилу Александровичу. В 1383 оно слилось с великим княжеством Владимирским, поскольку московские князья закрепили за собой великое княжение. При Иване III, с присоединением Новгорода, Твери и других территорий, Великое княжество Московское переросло в Российское государство. ",2
,1383,Образование Великого княжества Тверского,"Тверское княжество выделилось в 1247 году по смерти великого князя Ярослава Всеволодича.
С 1383г. оно стало именоваться великим княжеством.
В 1485 г. Великое княжество Тверское было присоединено к Московскому великому княжеству в результате объединительной политики Ивана III, стремившегося подчинить своей власти всю Русь. Поводом для подчинения Твери Москве стали сношения тверского князя с польским королем Казимиром IV, запрещенные согласно московско-тверскому договору. ",2
,1383,Постепенное продвижение древнерусской колонизации на восток,"Остров Новая Сибирь открыта промышленником Яковом Сыроватским в 1806 г. В том же 1806 г. нижнеиндигирские охотники Чихачев, Рожин, Котевщиков и Портнягин видели эту землю. Сначала остров обозначался как «Земля, открытая купцом Сыроватским». Матвей Геденштром в 1810 г. посетил восточную часть острова, дав ему имя Новая Сибирь «по причине значительной величины острова и угрюмости». Позже от имени этого острова образовано название всего архипелага.",2
,1390,Постепенное продвижение древнерусской колонизации на восток,"<a href=""https://www.runivers.ru/newenc/474766/"" target=""_blank"">Тильзитский мирный договор (25 июня / 8 июля 1807 г.)</a><br />",1
,1392,Переход к Московскому княжеству Тарусы,,2
,1392,Ликвидация Нижегородско-Суздальского княжества. В 1392 г. вошло в состав Московского великого княжества,,2
,1403,Захват Великим княжеством Литовским Вяземского княжества,"Фридрихсгамский мирный договор 5/17 сентября 1809 г. подписан между Россией и Швецией по итогам русско-шведской войны 1808–1809 гг. в г. Фридрихсгам (Финляндия). Со стороны России договор подписали Н. П. Румянцев и Д. М. Алопеус, со стороны Швеции – Л. Стединг и А. Шёльдебранд. По условиям договора Россия получала Финляндию и Аландские острова. Граница между Россией и Швецией проводилась по рекам Торнио и Муонно. Швеция обязывалась подписать мирные договоры с Францией и Данией и закрыть порты для британских судов. Восстанавливалась русско-шведская торговля. Швеция получала право на ежегодную беспошлинную закупку в русских портах зерна и муки в количестве 50 тыс. четвертей. За Россией сохранялось право беспошлинного вывоза в течение трех лет из Швеции меди, железа, извести, камня, из Финляндии – скота, рыбы, хлеба, смолы, леса. Секвестрированное во время войны имущество возвращалось владельцам с обеих сторон. Ряд статей договора регулировал правовое и имущественное положение шведского населения на территории Финляндии и финского на территории Швеции. 

<a href=""http://www.runivers.ru/doc/d2.php?CENTER_ELEMENT_ID=147709"" target=""_blank"">Текст Фридрихсгамского мирного договора</a><br />",1
