numb,year,description_short,description_long,count
1,1825,По англо-русской конвенции 1825 г. произошло разграничение владений России и Великобритании в Северной Америке.,"Устанавливалась пограничная черта, отделяющая владения Британии от русских владений на западном побережье Северной Америки, примыкающем к Аляске, так, что граница проходила на всем протяжении береговой полосы, принадлежащей России, от 54° с. ш. до 60° с. ш. по вершинам гор Берегового хребта, но не далее 10 морских миль от кромки океана, учитывая все изгибы побережья.
<a href=""https://www.runivers.ru/bookreader/book9848/#page/71/mode/1up"" target=""_blank"">Конвенция, заключенная в Санкт-Петербурге между Императором Всероссийским и Королем Великобританским о взаимных выгодах, относящихся до торговли, мореплавания и рыбных промыслов на Тихом океане и до границ обоюдных владений их на северо-западном берегу Америки</a><br />",1
1,1826,По русско-норвежскому договору Шведско-норвежскому королевству переданы части Нявдемского и Пазрецкого погостов.,"<a href=""https://upload.wikimedia.org/wikipedia/commons/2/21/Norway-Russia_1825.jpg"" target=""_blank"">Карта норвежско-российской границы (1826)</a><br />

<a href=""http://www.runivers.ru/bookreader/book9864/#page/410/mode/1up"" target=""_blank"">Текст «Трактата, заключенный между Его Величеством Императором Всероссийским и Его Величеством Королем Шведским и Норвежским. О границах между Россиею и Норвегиею в Лапландских погостах»</a><br />",1
1,1827,Балкария вошла в состав Российской империи.,"11 января 1827 г. в Ставрополе делегацией балкарских князей генералу Георгию Эммануэлю было подано прошение о принятии Балкарии в подданство России.
Генерал Эммануэль привел балкарцев и дигорцев к присяге и письменно обещал ходатайствовать перед государем о сохранении за ними всего того, о чем они просили. Обо всем происшедшем генерал Эммануэль донес командующему Кавказской армией генерал-адъютанту Паскевичу, а тот довел до сведения императора Николая I. 
2 мая 1827 г. начальник главного штаба Дибич уведомил Паскевича о том, что государь с удовольствием узнал о подданстве горцев и приписал это событие «благоразумным мерам и кроткому с сими горцами обхождению генерал-лейтенанта Емануэля».
Условия присяги 1827 г. были подтверждены делегации балкарских князей во время их визита к российскому императору в 1852 г. В докладной записке канцелярии военного министра от 22 апреля 1852 г. министру о дозволении прибыть в Санкт-Петербург депутации от горских обществ Балкарии записано: «...Поименованные племена, по засвидетельствованию начальника Кавказской линии, отличаются постоянной преданностью правительству и примерным повиновением местным властям...»

<a href=""http://www.vostlit.info/Texts/Dokumenty/Kavkaz/XIX/1820-1840/Probl_kavk_vojny/1-20/1.htm"" target=""_blank"">Текст прошения</a><br />",1
1,1828,По Туркманчайскому мирному договору к России отошли территории Эриванского и Нахичеванского ханства.,"Договор был подписан между Россией и Персией в деревне Туркманчай (близ Тебриза) по итогам русско-персидской войны 1826–1828 гг. С русской стороны его подписали И. Ф. Паскевич и А. М. Обресков, с персидской – Аббас-Мирза и мирза Абуд-Хасан-Хан. Подготовкой текста договора и предварительными переговорами со стороны России занимался А. С. Грибоедов.

По условиям договора Россия получала Эриванское и Нахичеванское ханства (Восточная Армения). Персидские власти обязывались не препятствовать переселению армян в Россию. Персия должна была выплатить России контрибуцию в размере 20 млн руб. Подтверждалось исключительное право России иметь военный флот на Каспии. Русские торговые суда получали там права свободного плавания. России предоставлялся ряд торговых привилегий. К договору был приложен «Особый акт о торговле». Согласно ему, все дела и тяжбы между подданными России и подданными других держав на территории Персии подлежали юрисдикции русских дипломатических служб. Судебные дела между русскими и персами подлежали компетенции персидских властей, но должны были рассматриваться обязательно в присутствии драгоманов русской миссии. 
Туркманчайский мирный договор на долгие годы стал основой для русско-персидских отношений. Он значительно усилил положение России в Закавказье и открыл возможность для расширения политического и экономического продвижения России в Среднюю Азию.

<a href=""http://www.runivers.ru/bookreader/book456128/#page/242/mode/1up"" target=""_blank"">Текст Туркманчайского мирного договора</a><br />

<a href=""http://www.runivers.ru/mp/maps-detail.php?ID=466778&SECTION_ID="" target=""_blank"">Территориальные изменения по Туркманчайскому мирному договору (карта)</a><br />",1
1,1829,"По Адрианопольскому мирному договору Россия получала все черноморское побережье Кавказа от устья Кубани до Аджарии, крепости Ахалцих и Ахалкалаки, а также устье Дуная с островами.","Договор подписан между Россией и Турцией по итогам русско-турецкой войны 1828–1829 гг. в г. Адрианополе (Турция). Со стороны России договор подписали А. Ф. Орлов и Ф. П. Пален, со стороны Турции – Мехмед Садык-эфенди и Абдул Кадыр-бей. Согласно договору, Россия получала все черноморское побережье Кавказа от устья Кубани до Аджарии, крепости Ахалцих и Ахалкалаки, а также устье Дуная с островами. Русские подданные могли вести свободную торговлю на территории Турции. Русские торговые суда получали право беспрепятственно проходить проливы Босфор и Дарданеллы. Русские подданные на турецкой территории не подлежали турецкой юрисдикции. На Турцию была наложена контрибуция в 1,5 млн гульденов, которые она обязана была выплатить России в течение 1,5 лет. Дунайские княжества (Молдавия, Валахия) формально оставались в составе Турции, но получали широкую автономию. Их зависимость от Турции фактически сводилась к выплате дани. Гарантом автономии объявлялась Россия. Широкую автономию получала также Греция. Договор подтверждал автономию Сербии, предоставленную ей Аккерманской конвенцией 1826 г.

Адрианопольский мир стал крупной дипломатической победой России. В ее состав почти полностью вошло Закавказье. С ее помощью значительно продвинулось дело освобождения сербского, молдавского и греческого народов от турецкого ига.

<a href=""http://www.runivers.ru/doc/d2.php?CENTER_ELEMENT_ID=146928"" target=""_blank"">Текст договора</a><br />

<a href=""http://www.runivers.ru/bookreader/book9867/#page/623/mode/1up"" target=""_blank"">Оригинал договора</a><br />",2
2,1829,"По Адрианопольскому мирному договору Россия получала все Черноморское побережье Кавказа от устья Кубани до Аджарии, крепости Ахалцих и Ахалкалаки, а также устье Дуная с островами.","Договор подписан между Россией и Турцией по итогам русско-турецкой войны 1828–1829 гг. в г. Адрианополе (Турция). Со стороны России договор подписали А. Ф. Орлов и Ф. П. Пален, со стороны Турции – Мехмед Садык-эфенди и Абдул Кадыр-бей. Согласно договору, Россия получала все Черноморское побережье Кавказа от устья Кубани до Аджарии, крепости Ахалцих и Ахалкалаки, а также устье Дуная с островами. Русские подданные могли вести свободную торговлю на территории Турции. Русские торговые суда получали право беспрепятственно проходить проливы Босфор и Дарданеллы. Русские подданные на турецкой территории не подлежали турецкой юрисдикции. На Турцию была наложена контрибуция в 1,5 млн гульденов, которые она обязана была выплатить России в течение 1,5 лет. Дунайские княжества (Молдавия, Валахия) формально оставались в составе Турции, но получали широкую автономию. Их зависимость от Турции фактически сводилась к выплате дани. Гарантом автономии объявлялась Россия. Широкую автономию получала также Греция. Договор подтверждал автономию Сербии, предоставленную ей Аккерманской конвенцией 1826 г.

Адрианопольский мир стал крупной дипломатической победой России. В ее состав почти полностью вошло Закавказье. С ее помощью значительно продвинулось дело освобождения сербского, молдавского и греческого народов от турецкого ига.

<a href=""http://www.runivers.ru/doc/d2.php?CENTER_ELEMENT_ID=146928"" target=""_blank"">Текст договора</a><br />

<a href=""http://www.runivers.ru/bookreader/book9867/#page/623/mode/1up"" target=""_blank"">Оригинал договора</a><br />",2
1,1832,"По Лондонской конвенции княжество Самос получило статус вассального княжества под сюзеренитетом Османской империи и защитой Российской империи, Британской империи и Королевства Франция","<a href=""http://www.runivers.ru/bookreader/book10090/#page/384/mode/1up"" target=""_blank"">Лондонская конвенция 1827 г.</a><br />",2
2,1832,"Установление военного управления регионом на Кавказе. Территория, охваченная Кавказской войной, обозначена отдельно как условно подконтрольная.",,2
1,1833,Княжество Сванетия вошло в состав России.,,1
1,1849,В ходе реформы управления на Кавказе произошло перераспределение территорий между зависимыми от Российской империи Абхазией и Мингрелией. Часть земель Абхазского княжества оказалась в составе Мингрелии.,,1
1,1853,Взятие укрепления Ак-Мечеть привело к дальнейшему завоеванию Кокандского ханства.,,1
1,1854,"Создана область сибирских киргизов, которая включила не только прежние земли Омской области, но и территории к югу и западу.","Создана административно-территориальная единица Российской империи Область сибирских киргизов, куда вошли Кокчетавский, Кушмурунский, Акмолинский, Барнаульский и Каркаралинский округа. Включила не только прежние земли Омской области, но и новые территории к югу и западу.

<a href=""http://www.runivers.ru/bookreader/book9917/#page/514/mode/1up"" target=""_blank"">Область образована Высочайшим утверждением 19 мая 1854 г.
Текст.</a><br />

<a href=""http://www.runivers.ru/lib/book3308/16866/"" target=""_blank"">Материалы для географии и статистики России, собранные офицерами Генерального штаба. Область сибирских киргизов.</a><br />",1
1,1855,"Согласно Симодскому трактату, остров Итуруп стал японским, а весь Уруп и другие Курильские острова к северу российской территорией. Остров  Сахалин оставался в совместном владении.","Согласно Симодскому трактату, «отныне границы между Россией и Японией будут проходить между островами Итурупом и Урупом. Весь остров Итуруп принадлежит Японии, а весь остров Уруп и прочие Курильские острова к северу составляют владение России. Что касается острова Крафто (Сахалина), то он остается не разделенным между Россией и Японией, как было до сего времени».
Остров Итуруп был уступлен Японии в обмен на торговый договор, а Уруп стал самым южным островом России в Курильской гряде.

<a href=""https://ru.wikisource.org/wiki/%D0%A1%D0%B8%D0%BC%D0%BE%D0%B4%D1%81%D0%BA%D0%B8%D0%B9_%D0%B4%D0%BE%D0%B3%D0%BE%D0%B2%D0%BE%D1%80_%D1%81_%D0%AF%D0%BF%D0%BE%D0%BD%D0%B8%D0%B5%D0%B9_(1855)"" target=""_blank"">Текст Симодского трактата</a><br />",1
1,1858,"Согласно Айгунскому договору, левый берег Амура, от реки Аргуни до устья, признавался собственностью России, а Уссурийский край, от впадения Уссури в Амур до моря, оставался в общем владении впредь до определения границы.","Левый берег Амура, от реки Аргуни до устья, признавался собственностью России, а Уссурийский край, от впадения Уссури в Амур до моря, оставался в общем владении впредь до определения границы.

<a href=""http://istmat.info/node/27120"" target=""_blank"">Текст Айгунского договора</a><br />",1
1,1859,Сванетия вошла в состав Кутаисского генерал-губернаторства.,В 1833–1840 гг. княжество Сванетия номинально вошло в состав Российской империи. К 1859 г. княжество было упразднено и район составил отдельное приставство Сванетия в составе Кутаисского генерал-губернаторства.,1
1,1860,"Согласно Пекинскому договору от 1860 г., Россия получила Приморский край.","Согласно Пекинскому договору, заключенному 2 ноября 1860 г., «с сих пор восточная граница между двумя государствами, начиная от слияния рек Шилки и Аргуни, пойдет вниз по течению реки Амура до места слияния сей последней реки с рекой Усури. Земли, лежащие по левому берегу (на север) реки Амура, принадлежат российскому государству, а земли, лежащие на правом берегу (на юг), до устья реки Усури, принадлежат китайскому государству. Далее от устья реки Усури до озера Хинкай граничная линия идет по рекам Усури и Сунгача.
Земли, лежащие по восточному (правому) берегу сих рек, принадлежат российскому государству, а по западному (левому) – китайскому государству. Затем граничная между двумя государствами линия, от истока реки Сун'гача, пересекает озеро Хинкай и идет к реке Бэлэн-хэ (Тур), от устья же сей последней, по горному хребту, к устью реки Хубиту (Хубту), а отсюда по горам, лежащим между рекой Хуньчунь и морем, до реки Ту-мынь-дзян. Здесь также земли, лежащие на востоке, принадлежат российскому государству, а на запад – китайскому. Граничная линия упирается в реку Ту-мынь-дзян на двадцать китайских верст (ли), выше впадения ее в море».

<a href=""https://ru.wikisource.org/wiki/%D0%9F%D0%B5%D0%BA%D0%B8%D0%BD%D1%81%D0%BA%D0%B8%D0%B9_%D0%B4%D0%BE%D0%B3%D0%BE%D0%B2%D0%BE%D1%80_(1860)"" target=""_blank"">Текст Пекинского договора</a><br />",1
1,1861,Занятие Яны-Кургана русскими войсками привело к расширению территории российского государства,"23 сентября 1861 г. русские войска разрушили кокандскую крепость Яны-Курган на правобережье Сыр-Дарьи. Так постепенно были образованы Оренбургская и Западно-Сибирская, а впоследствии Сыр-Дарьинская пограничные линии.",1
1,1865,"Создана Туркестанская область, которая  была образована из территорий Сыр-Дарьинской, Ново-Кокандской линий и завоеванных частей Кокандского ханства. ","Туркестанская область была образована 12 февраля 1865 г. из территорий Сыр-Дарьинской, Ново-Кокандской линий и завоеванных частей Кокандского ханства. Туркестанскую область подчинили оренбургскому генерал-губернатору М. Г. Черняеву, одновременно являвшемуся командующим войсками Оренбургского военного округа.",1
1,1866,"Ташкент, Ходжент, Зачирчикский край были присоединены к Туркестанской области.","Через 14 месяцев после захвата города русскими войсками, в августе 1866 г. был издан царский указ о присоединении Ташкента, и 27 августа 1866 г. его жители приняли русское подданство. Ташкент, Ходжент, Зачирчикский край были присоединены к Туркестанской области.",1
1,1868,Бухарский эмир признал вассалитет по отношению к России.,"После успешных Бухарских походов русских войск, 23 июня 1868 г. был заключен русско-бухарский договор, согласно которому Бухарский эмират переходил под протекторат России.
Бухарский эмир Музаффар ад-Дин признал вхождение в состав Российской империи части территории Бухарского эмирата с городами Джизак, Ура-Тюбе и Ходжент.
Из этих территорий был образован Зеравшанский округ с двумя отделами: Самаркандским и Катта-Курганским. Главой округа и руководителем военно-народной администрации был назначен А. К. Абрамов, произведенный в генерал-майоры.
Договор не был ратифицирован Александром II.",2
